Name,Description,Recipe,Source
Monster Musk,Spray this on to draw more monsters out of hiding.,"Bat Wing(30), Slime(30)",Wizard(Special Order)
Fairy Dust,"Sprinkle on kegs, furnaces, and other refining equipment to instantly receive their product.","Diamond(1), Fairy Rose(1)",The Pirate's Wife Quest
Warp Totem: Beach,Warp directly to the beach. Consumed on use.,"Hardwood(1), Coral(2), Fiber(10)",Foraging Level 6
Warp Totem: Mountains,Warp directly to the mountains. Consumed on use.,"Hardwood(1), Iron Bar(1), Stone(25)",Foraging Level 7
Warp Totem: Farm,Warp directly to your house. Consumed on use.,"Hardwood(1), Honey(1), Fiber(20)",Foraging Level 8
Warp Totem: Desert,Warp directly to Calico Desert. Consumed on use.,"Hardwood(2), Coconut(1), Iridium Ore(4)",Desert Trader for  Iridium Bar(10)
Warp Totem: Island,Warp directly to Ginger Island. Consumed on use.,"Hardwood(5), Dragon Tooth(1), Ginger(1)","Volcano Dwarf shop for 10,000g"
Rain Totem,Activate to greatly increase the chance for rain tomorrow. Consumed on use.,"Hardwood(1), Truffle Oil(1), Pine Tar(5)",Foraging Level 9
